{
  "pipeline_id": "00000000-0000-4000-8000-000000000030",
  "anon_borrower_id": "00000000-0000-4000-8000-000000000099",
  "requirement_id": "00000000-0000-4000-8000-000000000040",
  "file_name": "payslips.pdf",
  "mime_type": "application/pdf",
  "size_bytes": 482113,
  "source": "vault",
  "document_date": "2026-09-30"
}
